{
  "schema_version": 1,
  "artifact_kind": "platform_deployment_profile",
  "profile_id": "specgraph_bootstrap_internal",
  "display_name": "SpecGraph Bootstrap Internal",
  "description": "Maintainer-facing internal profile for evolving SpecGraph itself. Git Service writes remain disabled except for dry-run planning.",
  "workflow_lane": "specgraph_bootstrap",
  "deployment_surface": "specgraph_bootstrap_internal",
  "authority_profile": "maintainer_bootstrap_controlled",
  "exposes": [
    "specgraph_bootstrap",
    "supervisor_self_evolution",
    "proposal_runtime",
    "local_operator_diagnostics"
  ],
  "hides": [
    "product_idea_to_spec_workbench"
  ],
  "git_service": {
    "mode": "dry_run_only",
    "allowed_workflow_lanes": [
      "specgraph_bootstrap"
    ],
    "denied_workflow_lanes": [
      "product_idea_to_spec"
    ],
    "allowed_target_repository_roles": [
      "specgraph_bootstrap"
    ],
    "denied_target_repository_roles": [
      "product_spec_workspace"
    ],
    "allowed_authority_profiles": [
      "maintainer_bootstrap_controlled"
    ],
    "denied_authority_profiles": [
      "workspace_owner_controlled",
      "self_evolution"
    ],
    "required_promotion_request_fields": [
      "workflow_lane",
      "deployment_profile_id",
      "target_repository_role",
      "authority_profile"
    ]
  },
  "authority_boundary": {
    "exposes_bootstrap_surfaces": true,
    "permits_self_evolution": true,
    "permits_git_service_write": false,
    "permits_auto_merge": false,
    "publishes_private_artifacts": true
  }
}
